{
  "checkboxes": [
    {
      "field": "Perils Insured Against - Basic",
      "value": "No"
    },
    {
      "field": "Perils Insured Against - Broad",
      "value": "No"
    },
    {
      "field": "Perils Insured Against - Special",
      "value": "Yes"
    }
  ],
  "document_date": "2026-08-15",
  "form_info": {
    "form_edition": "2016/03",
    "form_number": "ACORD 27",
    "form_title": "EVIDENCE OF PROPERTY INSURANCE"
  },
  "header": {
    "carrier_name": "Midsouth Insurance Group",
    "effective_date": "2025-08-01",
    "expiration_date": "2026-08-01",
    "insured_address": "300 Liberty Avenue, Suite 1200",
    "insured_city": "Pittsburgh",
    "insured_name": "Keystone Commercial Builders, Inc.",
    "insured_state": "PA",
    "insured_zip": "15222",
    "policy_number": "CP-KCB-2025-4551",
    "producer_code": null,
    "producer_name": "Reed City Insurance Group"
  },
  "interests": [
    {
      "address": "267 Forbes Street, Pittsburgh, PA 15221",
      "interest_type": "First Mortgagee",
      "loan_number": "C2339",
      "name": "M&T Bank"
    }
  ],
  "locations": [
    {
      "address": "300 Liberty Avenue, Suite 1200",
      "bi_value": 2500000,
      "building_value": null,
      "city": "Pittsburgh",
      "construction": "Non-Combustible",
      "contents_value": 1200000,
      "fire_alarm_type": null,
      "location_number": null,
      "occupancy": "Office",
      "roof_type": null,
      "sprinkler_type": null,
      "sprinklered": true,
      "square_feet": null,
      "state": "PA",
      "stories": null,
      "tiv": null,
      "year_built": null,
      "zip": "15222"
    }
  ],
  "policy_form_type": "special",
  "property_deductible": 25000,
  "remarks": "Coverage provided for special form. Property is fully sprinklered. Construction type: Non-Combustible."
}